# LogicTest: multiregion-9node-3region-3azs

query TTTT colnames
SHOW REGIONS
----
region          zones                   database_names  primary_region_of
ap-southeast-2  {ap-az1,ap-az2,ap-az3}  {}              {}
ca-central-1    {ca-az1,ca-az2,ca-az3}  {}              {}
us-east-1       {us-az1,us-az2,us-az3}  {}              {}

statement ok
CREATE DATABASE db PRIMARY REGION "ca-central-1" REGIONS "ap-southeast-2", "us-east-1";
USE db

query TTTTIT
SHOW TABLES
----

statement ok
ALTER DATABASE db SET AUTOMATIC MULTIREGION ON

query TTTTIT
SHOW TABLES
----
public  crdb_internal_auto_multi_region_row  table  root  0  REGIONAL BY ROW AS crdb_region
public  crdb_internal_auto_multi_region_tab  table  root  0  REGIONAL BY ROW AS crdb_region


statement ok
CREATE TABLE expect_regional_by_row (i INT, PRIMARY KEY (i))

query T nodeidx=0
SELECT gateway_region()
----
ap-southeast-2

statement ok
INSERT INTO expect_regional_by_row VALUES (1975)

query TTII colnames,retry
SELECT crdb_region, tab, reads, writes FROM crdb_internal_auto_multi_region_tab
----
crdb_region     tab  reads  writes
ap-southeast-2  expect_regional_by_row    0      1

query T nodeidx=6
SELECT gateway_region()
----
us-east-1

# FIXME: The "USE" below is required because the nodeidx on statements
#  doesn't properly setup the connection to use the original database.  This
#  should be corrected.
statement ok nodeidx=6
USE db;
INSERT INTO expect_regional_by_row VALUES (1980)

query TTII colnames,retry
SELECT crdb_region, tab, reads, writes FROM crdb_internal_auto_multi_region_tab
----
crdb_region     tab  reads  writes
ap-southeast-2  expect_regional_by_row    0      1
us-east-1       expect_regional_by_row    0      1

query I nodeidx=0
USE db;
SELECT i from expect_regional_by_row where i = 1975
----
1975

query TTII colnames,retry
SELECT crdb_region, tab, reads, writes FROM crdb_internal_auto_multi_region_tab
----
crdb_region     tab  reads  writes
ap-southeast-2  expect_regional_by_row    1      1
us-east-1       expect_regional_by_row    0      1

query I nodeidx=3
USE db;
SELECT i from expect_regional_by_row where i = 1975
----
1975

query I nodeidx=6
USE db;
SELECT i from expect_regional_by_row where i = 1980
----
1980

query TTII colnames,retry
SELECT crdb_region, tab, reads, writes FROM crdb_internal_auto_multi_region_tab
----
crdb_region     tab  reads  writes
ap-southeast-2  expect_regional_by_row    1      1
ca-central-1    expect_regional_by_row    1      0
us-east-1       expect_regional_by_row    1      1

query TII colnames,retry
SELECT crdb_region, reads, writes FROM crdb_internal_auto_multi_region_row order by (crdb_region, reads, writes)
----
crdb_region     reads  writes
ap-southeast-2  1      1
ca-central-1    1      0
us-east-1       1      1

query I nodeidx=0
USE db;
SELECT i from expect_regional_by_row where i = 1975
----
1975

query TTII colnames,retry
SELECT crdb_region, tab, reads, writes FROM crdb_internal_auto_multi_region_row order by (crdb_region, tab, reads, writes)
----
crdb_region     tab                     reads  writes
ap-southeast-2  expect_regional_by_row  2      1
ca-central-1    expect_regional_by_row  1      0
us-east-1       expect_regional_by_row  1      1

statement ok
INSERT INTO expect_regional_by_row values (2002)

query TTII colnames,retry
SELECT crdb_region, tab, reads, writes FROM crdb_internal_auto_multi_region_row order by (crdb_region, tab, reads, writes)
----
crdb_region     tab                     reads  writes
ap-southeast-2  expect_regional_by_row  0      1
ap-southeast-2  expect_regional_by_row  2      1
ca-central-1    expect_regional_by_row  1      0
us-east-1       expect_regional_by_row  1      1


#query TTT colnames
#SELECT tab, SUM(reads) as sum_reads, SUM(writes) as sum_writes FROM crdb_internal_auto_multi_region_row group by (tab, pk_sha) order by (tab, pk_sha)
#----
#tab  sum_reads  sum_writes
#t    5          1
#t    5          1
#t    0          1
#t    0          1


query TTIIF colnames
SELECT * FROM crdb_internal.auto_multi_region
----
region            table_name              reads  writes  pct_reads
'ap-southeast-2'  expect_regional_by_row  2      2       0.5
'ca-central-1'    expect_regional_by_row  1      0       1
'us-east-1'       expect_regional_by_row  1      1       0.5


statement ok
CREATE TABLE expect_global_recommendation (i INT);
INSERT INTO expect_global_recommendation VALUES (100),(200),(300),(400)

repeat 20
query I nodeidx=1
USE db;
SELECT i FROM expect_global_recommendation ORDER BY i
----
100
200
300
400


repeat 5
query I nodeidx=3
USE db;
SELECT i FROM expect_global_recommendation ORDER BY i
----
100
200
300
400

repeat 3
query I nodeidx=6
USE db;
SELECT i FROM expect_global_recommendation ORDER BY i
----
100
200
300
400

statement ok
CREATE TABLE expect_regional_by_table_recommendation (i INT);
INSERT INTO expect_regional_by_table_recommendation VALUES (100),(200),(300),(400)

repeat 15
query I
SELECT i FROM expect_regional_by_table_recommendation ORDER BY i
----
100
200
300
400

query TIFFTFT colnames,retry
SHOW AUTOMATIC MULTIREGION RECOMMENDATIONS FOR DB
----
table_name                               total_ops  pct_reads               tbl_pct_affinitized     affinity_region   affinity_key            recommendation
expect_global_recommendation             116        0.96551724137931034483  0.72413793103448275862  'ap-southeast-2'  0.72413793103448275862  GLOBAL
expect_regional_by_row                   7          0.57142857142857142857  0.57142857142857142857  'ap-southeast-2'  0.91666666666666666667  REGIONAL BY ROW
expect_regional_by_table_recommendation  64         0.9375                  1                       'ap-southeast-2'  1                       REGIONAL BY TABLE IN 'ap-southeast-2'


statement ok
CREATE TABLE test_update (i int, j int, k int, l int, constraint "primary" PRIMARY KEY (i, k))

statement ok
INSERT INTO test_update VALUES (1,1,1,1),(2,2,2,2),(3,3,3,3)

statement ok
UPDATE test_update SET l = 4 where i = 1

statement ok
UPDATE test_update SET j = 5 where j = 3

# Not sure why we're getting an extra read here on each row.  I'd think it should only have
# one read for the updating row.
query TTII colnames,retry
SELECT crdb_region, tab, reads, writes FROM crdb_internal_auto_multi_region_row where tab = 'test_update' order by (crdb_region, tab, reads, writes)
----
crdb_region     tab          reads  writes
ap-southeast-2  test_update  1      1
ap-southeast-2  test_update  1      2
ap-southeast-2  test_update  2      2

statement ok
ALTER DATABASE db SET AUTOMATIC MULTIREGION OFF

query TTTTIT
SHOW TABLES
----
public  expect_global_recommendation             table  root  0  REGIONAL BY TABLE IN PRIMARY REGION
public  expect_regional_by_row                   table  root  0  REGIONAL BY TABLE IN PRIMARY REGION
public  expect_regional_by_table_recommendation  table  root  0  REGIONAL BY TABLE IN PRIMARY REGION
public  test_update                              table  root  0  REGIONAL BY TABLE IN PRIMARY REGION

